sentimen,teks
1,gubernur edy tutup semua akses buah pesantren larang siswa ajar sekap jumlah guru
1,video nyata mantan wakapolri komjen syafruddin pecat anggota polri bukti salah demo uu cipta kerja
1,surat mengatasnamakan gubernur wahidin halim minta dana aman pilkada
1,nyata buya syafii soal omnibus law
1,jarah itc roxy mas saat aksi massa omnibus law
1,jarah thamrin city
1,video siap pasu halau kelompok rusuh demo
1,guru ustaz masuk kelompok pertama terima vaksin covid tni polri masuk
1,polisi dandan orang rupa laskar fpi bekal ketapel sekitar monas
1,video rombong fpi motor saatdemonstrasi oktober
1,madam listrik malam hari siaga jelang september
1,waspada culik anak samar kampung
1,kabar rencana tawur besar gang aut bogor
1,pesan whatsapp mengatasnamakan jabat tinggi pemprov ntb
1,postingan anak buang orang tua surat
1,foto uya kuya tanya wakil presiden maruf amin apa kerja lama
1,orang pria tinggal dunia akibat keras polisi aksi protes antivaksin antimasker london
1,gunung salak belah jadi tiga
1,video kirim kardus mie instan guna drone
1,pesan beranta undi hadiah uang tunaidari telkomsel
1,mesin edc truemoney sedia
1,lintang kemukus tuban tanda bahaya
1,ada media televisi menyiarkanbersatunya demo lampung
1,bakar buah kafe malioboro gas air mata
1,pungli jalan by pass padang
1,langkah daftar prakerja kunjung situs prakerjavip
1,pesan whatsapp bupati sragen galang dana pondok panti
1,gerd picu mati dadak
1,program obat gratis rumah sakitpanti wilasa citarum
1,surat panggil interview pt hm sampoernatbk oktober
1,najwa shihab tulis kode minta lewatkertas bawa acara
1,video eks wakapolri soal polisi pukul demo
1,foto umum pabrik operasi
1,tolak omnibus law mahasiswa tabrak mobil pikap arah kerumun polisi
1,tni ikan tameng serta demo tolak uu cipta kerja
1,maklumat ksad siaga aksi oktober
1,tikus raksasa temu meksiko
1,pamflet jadwal berangkat kereta api nusa ekspres
1,bill gates kantong rp
1,arief puyouno yakin dana tanggulang covid dki banyak simpang gabenernya kaki tangan kadrun gila
1,semua keluarga milik kartu bpjs dapat blt rp juta
1,petinggi pki dn aidit turun habaib
1,vaksin corona asal tiongkok kandung babi
1,tutup bandara labuh laut ntt
1,sms mengatasnamakan stmik royal kisar
1,uang rp ribu tampil video musik
1,tak televisi berita aniesbaswedan terima tiga harga darikpk
1,who restu vaksin covid asal china
1,milik rumah makan jadi korban pungli satpol pp pademangan jakarta utara psbb
1,oles kelapa parut kunyit pare hilang stretch mark
1,foto wakil presiden kh maruf amin gaya ala kpop
1,rutin minum air putih hangat cegah asma kanker
1,tim medis kubur jenazah binatang
1,artikel detiktravel judul trans studio bandung tutup mulai hari untuk cegah sebar virus corona bandung
1,islamic center padang panjang tak awat
1,presiden jokowi takut datang markas pbb ancam sniper
1,pilkada jangan tunda pilpres tunda tahun
1,foto tangkap direktur national institute for allergy and infectious diseases niaid
1,informasi grup whatsapp wilayah covid bagi vaksin
1,akun facebook mengatasnamakan gubernur tanjungpinang serta istri
1,pesan whatsapp mengatasnamakan djp kabupaten pati
1,mobil esemka keluar baru siap angkut korban covid
1,nelayan kodingareng manfaat walhi tolak tambang pasir sulsel
1,putar film gspki tunjuk indonesia negara komunis
1,facebook larang live musik mulai oktober
1,flu bunuh kali lipat covid
1,pesan beranta sultan hamengkubuwono x sebut positif negatif corona podowae
1,foto habib rizieq shihab pakai serban logo palu arit
1,tenggorok kering tingkat risiko infeksi
1,mui cantum logo halal asbak
1,blog atas nama akhyar nasution plt wali kota medan
1,bambang trihatmodjo bukti jokowi asal keluarga pki
1,hadiah uang tunai program semarak lazada
1,fatwa hukum kisas keluar serang ulama
1,donald trump sindir isi pidato jokowi pbb
1,akun facebook mengatasnamakan walikota tanjungpinang
1,usai teror warga papua opm siap buru banser
1,bupati bintan janji kerja honorer
1,anies juara pertama lomba ngomong tingkat internasional
1,yos project pop ketua influencer dukung perintah
1,pasang pengantin baru meni tahun pacar
1,foto anies baswedan masuk peti mati
1,ikan hiu sangkut tiang listrik badai laura
1,foto unggah twitter tempoco edisi dengung
1,lazada indonesia ngadain giveaway ponsel uang tunai
1,buka daftar serta transmigrasi provinsi kalimantan tengah
1,akun facebook mengatasnamakan wali kota sibolga
1,hrs lapor tewas tabrak unta acara balap unta arab saudi
1,kumpul massa psht kota solo
1,video tokek panjang meter harga rptriliun
1,elvy sukaesih tinggal dunia karenacovid
1,pilkada serentak tunda di solo medan
1,perempuan pks kampanye istri cukup
1,foto megawati pidato podium logo palu arit
1,peti mati khusus buat kardus ketua kpu
1,juta kerja ancam batal terima subsidi gaji rp ribu
1,foto orang ayah larang anak hijab
1,surat spk ada sembako bantu sosial pemprov dki jakarta
1,curi organ mayat papar virus corona india
1,klaim deteksi virus corona covid tubuh swab test
1,akun instagram mengatasnamakan pusat informasi koordinasi covid provinsi jawa barat
1,habib rizieq keluh bagi sembako
1,kemenag resmi luncur sertifikasi da i
1,maruf amin ajak orang tonton paha
1,pesan beranta kelompok besar bentrok kalimalang
1,banjir cicurug sukabumi
1,ikan siluman tangkap laut cina selatan
1,minyak kayu putih mutih ketiak
1,mata ajar sejarah hapus kurikulum
1,akun facebook bupati bekas eka supria atmaja minta sumbang
1,razia masker non medis bundar dekat smpn kota malang
1,foto bakal calon wabup muratara inayatullah dua wanita dalam mobil
1,akun facebook mengatasnamakan istri gubernur jawa barat
1,surat putus tunda pilkada akibat pandemi covid
1,guna masker scuba larang alas politik
1,tes covid uk bagi konspirasi panen data dna biometrik manusia
1,prabowo umpat sebut dukung tak guna
1,lowong tenaga kerja pamsuska mengatasnamakan kai
1,laku jahat tusuk syekh ali jaber aku biaya megawati pki
1,panggil tes interview ptangkasa pura i tanggal september
1,serang syekh ali jaber ds tusuk ademadem aja ribut pks hti fpi rencana gagal geli dehhhh
1,foto orang kena seragam banser sedang sama orang wanita
1,presiden jadi tim sukses gibranteguh
1,rekam cctv tampak tuyul depan konter hp
1,istri sekda dki jakarta kritis rawat diicu
1,dunkin donuts ada program donat gratis
1,foto anies baswedan muncul film warkop dki
1,pesan beranta ibu bupati sleman adakan razia masker
1,pesan whatsapp ade agus hartanto ketua komisi i dprd riau tawar lelang mobil
1,ali mochtar ngabalin baiat gereja
1,surat terang laku untuk warga keluarmasuk makassar
1,merdekacom ramerame buru kambing hitam syekh ali jaber kelompok teroris
1,video klaim gambar mayat korban covid rusia
1,pesan beranta cara dapat kuota gratis dariprovider internet
1,larang liar luar rumah bagiremaja kulon progo
1,undang deklarasi jawa timur
1,akun facebook mengatasnamakan bupati landak
1,akun facebook pimpin umum majalah rantau dedi candra rosma yulfa
1,operasi tega protokol sehat kota malang
1,nomor whatsapp mengatasnamakan kepala bkn bima haria isana
1,pesan beranta whatsapp mengatasnamakan istri bupati siak razia siswa liar
1,nyata menteri sehat awan agus putranto
1,antre ambulance masuk wisma atlet semua ruang penuh
1,polisi rekrut preman menegakkanprotokol covid
1,foto wisuda ribu siswa sarajevo
1,foto africa vs africa in american movies
1,breaking news pesantren alquran bakar santri guru tinggal dunia moga gugur pesantren sebut husnul khotimah
1,ustadz bogor tinggal keroyok
1,foto akhir syekh ali jaber terbang pulang madinah
1,rekrutmen pegawai pln lulus sma hingga s tahun
1,akun facebook mengatasnamakan anggota polres trenggalek
1,karyawan pt bakrie autoparts positif corona
1,jokowi perlu besar besar tusuk ustad ali djaber kriminal biasa ustad ndak mati
1,undang resmi jalan tol pekanbarudumai
1,minum minum energi lebih sebab lubang besarpada tengkorak kepala
1,laku tusuk syekh ali jaber pegang bendera tauhid warna hitam
1,indonesia jadi negara kasus covid banyak
1,foto laku tusuk syekh ali jaber bebas syarat
1,presiden belarus klaim imf tawar suap batas covid
1,lama covid tidak orang gila kena covid
1,din syamsuddin mau geser maruf amin
1,polisi sumba timur turun jalan larang warga aktivitas
1,akun facebook mengatasnamakan ketua dprd mimika
1,video sepeda masuk tol usul anies kabul
1,denda psbb kota cilegon
1,kpk ott anies baswedan
1,fasilitas sehat bekas tak tampung pasien covid
1,bagibagi data internet gb tokopedia
1,hasil survei polmark pilwali makassar
1,kunyit putih hingga gula batu sembuh kanker payudara
1,informasi area sudah deteksi pandemi covid wilayah balikpapan
1,psbb jakarta jilid ii bagi skenario desak presiden jokowi mundur
1,menag sebut tusuk syeikh ali jaber kriminal biasa
1,sembur lumpur kranggan bekas
1,foto laku tusuk syekh ali jaber bendera pki
1,foto arteria dahlan dadak guna baju koko identitas bongkar
1,akun palsu mengatasnamakan wali kota tanjungbalai hm syahrial
1,wanita inggris tewas tusuk urin beku
1,foto anies dapat piala juara satu corona
1,daftar nama terima bantu umkmkabupaten mempawah
1,igd rumah sakit blambangan banyuwangitidak terima pasien
1,obat luka bakar es batu
1,ludah benih tanam restrukturisasi dna
1,dangdut aty kodong tinggal dunia
1,surat angkat cpns mengatasnamakan bkn pemkab sampang
1,akun facebook mengatasnamakan cabup pulau meranti
1,foto menteri agama kabinet jokowi pendeta kristen
1,ibunda cak nun tinggal
1,informasi daftar pasien klaster warung makan bu fat mengatasnamakan dinkes kota semarang
1,foto telah temu situs tinggal prasejarah masa raja firaun
1,ceo netflix tangkap tuduh pornografi anak
1,foto peta sebar covid jakarta warna hitam merah
1,badak makhluk bulan hewan sudah tahun tetap bumi
1,postingan minta dan rela jadi istri
1,akun twitter rektor ipb
1,akun facebook mengatasnamakan bupati bengkulu selatan gusnan mulyadi
1,bantu sosial mengatasnamakan bupati jepara
1,bayi blora tinggal harus rapid test
1,foto orang ayah sebrangkan anak sungai bisa pinjam hp teman sekolah online
1,rawan jadi positif covid sunti vaksin sinovac china
1,anies baswedan kendara mobil model peti mati
1,tni polisi unggah video tank tabrak gerobak pakai uu ite
1,rumah dp bentuk peti mati
1,foto anak kecil tulis keluh presidenjokowi papan tulis
1,kanker testis deteksi alat tes hamil
1,imbau warga jakarta keluar rumahkarena laku rapid test mall pasar
1,jokowi minta semua gubernur tiru kerja keras anies baswedan
1,minum air rebus serai jeruk teh turun berat badan waktu singkat
1,bupati lumajang beri bantu lewat whatsapp
1,tangkap layar obrol whatsapp christianyeugenia paruntu cep
1,wisma atlet cekam semua ruang penuh pasien covid
1,rapid test jalan cabut
1,ri larang wna masuk corona tka china
1,ledak kasus corona kudus capai
1,qari internasional asal papua
1,donald trump sebut jokowi presiden terbaikdi dunia
1,anies terima piagam dki jadi provinsi covidtertinggi
1,beberapa negara beli alat tes virus coronasejak
1,gambar tampil cakap habib rizieq tengku zulkarnain
1,panggil interview karyawan pt garuda indonesia september
1,pesan singkat hadiah rp juta shopee
1,kakek arteria dahlan pki
1,nama wakil bupati pasuruan masuk tim sukses menang gus ipul
1,akun facebook arthur waroka minta uang hingga pulsa warga
1,foto jack ma waktu kecil
1,ratus warga tiap camat kota serang positif covid
1,lihat papua aceh sejahtera timor lesteingin gabung indonesia
1,akhir jokowi selesai buat tol laut
1,putra sulung presiden gibran akanmembebaskan palestina israel
1,akun palsu haji martinus bakal calon walikota banjarbaru
1,surat menteri panrb kait terima catar poltekip poltekim
1,tenaga medis papar covid puskesmas baamang
1,kabar pdip bubar kader pindah psi
1,tingkat peluang hamil konsumsi buah zuriat
1,instagram batas ikut bisa lihat postingan
1,lebah bisa terbang
1,video tes tahan napas bantu analisa covid
1,tampak mobil ghoib esemka
1,harimau kurus beri makan kebun binatang maharani lamongan
1,video demo covid polandia tuntut pandemi akhir
1,peta kota bandung nyaris zona hitam
1,teliti australia sebut jokowi presiden mampu
1,foto tampak badan sambar petir
1,foto presiden jokowi masuk peti mati
1,kontes jin kait bakar gedung jaksa agung
1,virus corona sengaja sebar dokter tenaga medis apoteker
1,akun twitter tommy soeharto
1,devils tower pohon purba raksasa
1,nyata maruarar sebut orang tak pilih jokowi bodoh gila
1,bakar gedung jaksa agung mutih perkara
1,foto tampak sosok baju putih gedung jaksa agung bakar
1,anies batal pasang masker patung jendral sudirman anggap waras warga
1,video makan asli palsu buat china
1,vietcong ajar taktik gerilya indonesia
1,cctv jagung ikut bakar hangus
1,makan telur rebus tengah malam dapatmencegah covid
1,gedung jaksa bakar menko marves luhut minta mutih jumlah koruptor
1,akun whatsapp mengatasnamakan sekda kabupaten pulau layar
1,berkas arsip perkara hukum hangus bakar gedung jaksa agung
1,jokowi gagal tidak jadi presiden juta rakyat paksa angkat kaki
1,foto tampak tiga orang yangmenggantung anggota tni pohon
1,minum kopi jeruk nipis reda migrain
1,demokrat habib rizieq arab tak diri khilafah sana berani cuma di indonesia dasar provokator
1,guna obat trombolisis rspon bisa lebih jam jadi stroke
1,formulir online daftar kartu indonesia pintar
1,dokumen who kait anjur guna masker lama pandemi covid
1,foto kerja china laku cuti
1,guru tinggal akibat covid surabaya
1,foto sri mulyani jilbab kode pilkada dekat tagih jatuh tempo
1,puluh orang india joget raya mendagri india positif covid
1,nyata jokowi tumbuh ekonomi indonesia terjun bebas beri utang
1,gaji tambah jokowi upa mata uang yen
1,sms mengatasnamakan pimpin dosen karyawan universitas amikom yogyakarta
1,facebook bagibagi kuota internet gratis para guna
1,virus corona covid buat lab militer partai komunis china
1,mahasiswa bayar uang pangkal undip rp miliar
1,instruksi kemenbumn angkat advisor gaji rp juta
1,potret presiden jokowi ukur baju karya desainer ivan gunawan
1,alan layang tol cikampek gelombang garagara guna uji coba esemka ribu unit
1,pesawat jatuh tol banyumanik
1,busana jokowi inspirasi cerita fiksi
1,foto uang gambar perempuan cadar
1,prabowo subianto ingat gatot nurmantyo jangan bikin kisruh indonesia
1,akun facebook wakil ketua i dprd kota parepare tasming hamid tsm
1,tagih biaya asuransi mengatasnamakan jne
1,tni siap ambil alih kuasa jokowi makzul
1,putri presiden vladimir putin tinggal sunti dua vaksin covid
1,lukis tahun telah ramal hidup usai pandemi covid
1,negara arab rupa negara palingawal aku merdeka ri
1,orang pria buang uang rp juta jalanraya
1,akun facebook mengatasnamakan wakil dprd sulawesi utara
1,poster habib rizieq bakar seluruh anggota fpi kebal bacok kami siap perang
1,kpk gelar lomba petak umpat ingat hut ri
1,akun mengatasnamakan mantan gubernur kepri pinjam uang
1,tukar uang pecah rp ribu bayar utang negara
1,bahan baku uang kertas dollar amerika serat pohon pisang abaka
1,video pesta kembang api raya tahun baru islam hijriah
1,video kelompok wanita hijab injak bendera merah putih konten tiktok
1,burj khalifa hias bendera israel raya janji damai israel uni emirat arab
0,ramp check pesawat intensif hingga
0,pelindo i sambut kapal perdana sandar tahun
0,libur tahun baru tengah juta orang pergi keluar negeri
0,jumlah tumpang natal tahun baru labuh tanjung perak naik persen
0,orang kaya dunia versi bloomberg billionaire index
0,ap ii incar kelola bandara negara
0,sambut sri mulyani bicara soal sunti bpjs sehat
0,panjang bandara ap ii layan juta tumpang
0,utang ratus miliar rupiah wim cycle aju pkpu
0,terima negara lebih target defisit kecil sejak
0,refleksi sri mulyani kenang jajar jadi korban jt
0,berita ekonomi paling banyak baca tahun
0,korsel larang supermarket guna kantong plastik
0,panjang inflasi dki jakarta persen
0,terima pajak tak capai target bea cukai balik
0,target perintah soal jumlah wisman tak capai sebab
0,tahun angkasa pura i target dapat rp triliun
0,asi games temu imfbank dunia kunjung wisman naik persen
0,panjang angkasa pura i layan juta tumpang
0,defisit anggar imbang primer kecil sejak
0,kein ratarata inflasi bahan makan tahun akhir turun persen
0,ojk minta perban tak buruburu respon naik bunga acu
0,lebih target terima negara tahun tembus rp triliun
0,menko darmin tekan penting integritas pasar modal
0,lini bisnis tutup bei pantau first media
0,guna pesawat turun libur natal tahun baru
0,menko darmin yakin inflasi kendali
0,tutup tahun persen desa ntb alir listrik
0,pertamina ep target produksi minyak pangkal susu field barrel per hari
0,jangan lupa mulai hari layan oss pindah kantor bkpm
0,dirut mandiri prediksi bi naik suku bunga kali tahun
0,darmin tumbuh ekonomi indonesia jaga tengah perang dagang
0,awal tahun harga minyak dunia anjlok persen
0,harga bbm beras punya andil besar inflasi
0,milu lancar bos mandiri optimistis likuiditas perban baik
0,inflasi desember persen picu harga telur daging ayam
0,menko darmin optimisme punya dasar
0,kuartal iv tumbuh ekonomi singapura
0,gunung anak krakatau status siaga layar selat sunda minta waspada
0,dagang perdana ihsg gerak kuat tipis
0,realisasi apbn pecah rekor
0,tahun waskita beton precast target laba naik persen
0,sambut january effect sektor saham patut cermat
0,bisnis usaha nuklir bill gates hambat seteru aschina
0,lama mayoritas anggar esdm belanja infrastruktur
0,berita populer ekonomi grab hukum bayar kompensasi vietnam
0,negara paling inovatif dunia
0,risiko tinggi portofolio bisa jadi pilih investasi
0,panjang pelni angkut juta tumpang
0,perilaku masyarakat guna kantong plastik pandang ubah
0,esdm bangun terang jalan tenaga surya manggarai barat
0,hingga maret perintah pasti tarif listrik naik
0,semester i bri terbit obligasi rp triliun
0,brti blokir nomor telepon indikasi tipu
0,gandeng alipay bri garap turis asal china
0,pertamina teken kontrak jual beli kkks impor minyak kurang
0,merpati airlines ada gera tahun
0,bakal akuisisi usaha asuransi bri siap rp triliun
0,apa resolusi bill gates tahun
0,tahun baru konsumsi avtur bandara komodo justru turun
0,rombak direksi bri angkat sunarso jadi wakil direktur utama
0,inflasi rendah rupiah tutup kuat
0,akhir dana hasil tax amnesty tinggal ri perintah tak khawatir
0,kartu npwp hilang begini cara urus baru
0,bpjs sehat wajib faskes milik sertifikat akreditasi
0,tahun knks kembang uang syariah industri halal
0,sukses karier ikut tips di tahun
0,tawar sbr mulai januari minimal pesan rp juta
0,jasa marga sewa tempat rest area tol trans jawa mulai rp per meter
0,lima ka cabut subsidi pt kai tak naik harga tiket
0,perintah sektor riil jadi tulang punggung uang syariah
0,subsidi cabut tarif ka ekonomi tidak naik
0,menteri bappenas minta jabat knks langsung kerja full usai lantik
0,tahun jumlah korban celaka pesawat global naik tajam
0,jadi pusat ekonomi syariah global pr indonesia
0,potensi korupsi menkeu hatihati kucur dana tangan bencana
0,qatar airways beli persen saham china southern airlines
0,resolusi anti basi era disrupsi
0,sri mulyani sabet financial mister of the year
0,bulog klaim hasil stabil harga pangan lama
0,kepala bappenas lantik jabat komite nasional uang syariah
0,terap resolusi di tahun karier lesat
0,nilai tukar rupiah stabil kunci jaga inflasi tahun
0,menkeu tanggap curhat sutopo soal turun anggar mitigasi bencana
0,cukai rokok sumbang rp triliun kas negara
0,jumlah tumpang pesawat libur natal tahun baru turun
0,naik ump prediksi picu naik inflasi jakarta
0,bi sebut inflasi panjang jaga sasar inflasi
0,timses prabowosandi tantang sri mulyani transparan soal lonjak dana hibah
0,fakta apbn hibah roket hingga bengkak subsidi
0,jual china prediksi turun saham apple turun tajam
0,berita populer ekonomi negara paling inovatif dunia
0,kondisi ekonomi indonesia tahun prediksi baik
0,dagang perdana wall street kuat tipis
0,pajak tak capai target sri mulyani harap dunia usaha lebih patuh
0,kerja bitcoin prediksi cerah
0,pertamina turun harga pertalite pertamax hingga dex
0,menhub target reaktivasi jalur ka rampung tahun
0,jonan harga premium solar naik
0,rini tunjuk mantan direktur bri jadi dirut gadai
0,jonan sebut harga listrik akan naik hingga akhir
0,alas menhub pangkas dana awat operasi kereta api
0,waskita jaja ruas tol investor asing
0,perintah tambah subsidi operasi ka rintis
0,waskita karya tiga proyek utama target rampung tahun
0,gandeng bumn karya krakatau steel incar usaha baja lokal
0,tarif tambah lion air layan bagasi gratis cabut
0,subsidi energi bengkak jelas jonan
0,menpan rb reformasi birokrasi ubah zona nyaman perintah jadi kelas dunia
0,tinggal diesel pltmg flores guna gas mulai april
0,geger duga kerja paksa berapa benar gaji taiwan
0,polemik caption pesan gimmick hingga karakter diri
0,gubernur bi optimistis risiko ekonomi global tak setinggi
0,perintah pangkas dana awat operasi kereta api
0,tumpang lion air wings air kini bayar bagasi
0,realisasi pnbp sektor esdm tahun lampau target
0,kabar mahasiswa ri paksa tutup mulut kata perintah taiwan
0,taiwan tuding agen tenaga kerja sebar isu kerja paksa mahasiswa indonesia
0,bi prediksi inflasi awal tahun rendah
0,pertamina ep cepu bangun pabrik gas lapang jbt bojonegoro
0,perintah taiwan bantah ratus mahasiswa indonesia jalan kerja paksa
0,gubernur bi sebut alas rupiah kuat signifikan hari
0,bijak fiskal akan usung prabowosandiaga
0,perang dagang trump mulai pukul as sendiri
0,as china gelar runding dagang beijing pekan depan
0,bidik milenial uang kripto cyronium gandeng startup mesan hotel
0,rugi tahun berturutturut krakatau steel gencar restrukturisasi
0,stop benci kerja dengan cara
0,kapital pasar microsoft tinggi dunia
0,rupiah kuat tipis awal dagang jumat
0,keluar uni eropa resesi inggris depan mata
0,cara sederhana jadi lebih cerdas finansial
0,cara tepat aju naik gaji tahun
0,wamen esdm minta warga manggarai barat jaga lampu jalan tenaga surya
0,dapat disney box office tembus
0,jasa tulis caption medsos upaya penuh butuh engagement
0,produk mewah mulai imbas lambat ekonomi china
0,berita populer timses prabowosandi tantang sri mulyani
0,bangun jalan tol tambah beban utang negara fakta
0,saham anjlok nilai usaha apple jauh triliun dollar as
0,jasa buat caption zarry hendrik bisnis unik rangkai kata
0,erick thohir ekonomi indonesia terus tumbuh
0,merpati pakai pesawat buat rusia indonesia timur
0,soal atur ojek online gojek tunggu undang perintah
0,kena tarif bagasi lion air group dapat tuju kemenhub
0,garis besar ada atur ojek online kemenhub
0,menhub cek bijak lion air group kena tarif bagasi
0,menhub atur ojek online cakup pasti dapat kemudi
0,riset bukti millenial rencana uang baik
0,cerita mantan mahasiswa indonesia taiwan kaget dengar isu kerja paksa
0,hambat serap beras perintah perlu evaluasi terap hpp
0,gubernur the fed akan mundur meski desak trump
0,harga bbm nonsubsidi turun daftar
0,tujuh fakta atas opini pks soal ekonomi indonesia
0,bagaimana atur kerja mahasiswa indonesia taiwan
0,bangkit listrik tenaga gas pln hemat ongkos produksi
0,reaktivasi jalur ka banjarpangandaran kata menhub
0,wings air buka rute baru bandara kertajati yogyakarta
0,usaha logistik tawar kirim hitung menit
0,kemenhub usul bus trans java komentar organda
0,startup ingin gencar arisan online
0,rahasia sukses bosbos besar indonesia
0,beda lakilaki perempuan milenial cari kerja
0,kisah lea jeans tangan generasi dua
0,tips bisa jawab tanya wawancara kerja
0,cumi startup besut christian sugiono inspirasi main anak
0,mahal dunia ekor ikan tuna jual rp
0,kerja apa buat bahagia cek
0,berita populer pek lion air cabut layan bagasi gratis hingga harga pertamax cs turun
0,harga bisnis lanjut libat usaha
0,daerah tumbuh transaksi tinggi gofood
0,kemenhub temu organda bahas bus trans java
0,perintah buka keran impor jagung ton
0,bi awas transaksi ecommerce antarnegara
0,kapal lintas merakbakaheuni di bawah gt
0,sri mulyani anggap kritik bank dunia soal infrastruktur masuk baik
0,staf khusus darmin nasution pegang kendali bp batam masa transisi
0,jadi favorit paket ayam nyaris pes juta kali gofood
0,kemenhub tunda laku wajib kapal minimal gt merakbakaheuni
0,himbara pertamina telkom godok sistem bayar qr code
0,gubernur bi lantik jabat baru
0,data integrasi arus devisa hasil ekspor pantau real time
0,kapal buat china layan seberang merakbakauheni
0,bank mandiri gencar bisnis segmen tengah
0,tak bawa pulang devisa hasil ekspor sanksi nanti usaha
0,bank mandiri tunjuk direktur komersial baru
0,waspada modus tipu tanya nomor otp nasabah bca
0,tahun makan sehat unik bakal banyak pes lewat gofood
0,paket ayam goreng makan paling banyak pes lewat gofood
0,ungkap zodiak paling banyak hasil miliarder
0,gempur edar barang ilegal strategi bea cukai
0,sistem manifest generasi iii pangkas dwell time hampir hari
0,target ekspor lebih tinggi strategi kemendag
0,fakta cabut bagasi gratis lion air wings air
0,mulai hari jepang terap pajak turis
0,kuat rp per dollar as bi nilai rupiah undervalued
0,terap sistem manifest generasi iii ri lebih pandang dunia
0,cimb beri cuti hamil bulan pegawai sambut anak pertama
0,iata tak heran sri mulyani jadi menteri uang baik
0,faktor eksternal jadi sebab garang rupiah hari
